region_user,cell_type_label,allen_subclass_anchor,n_cells_in_anchor,cell_type_marker_genes,exclusion_markers,paper_suggested_gpcrs,allen_validated_top_picks,combined_GPCRs_for_probe,combined_evidence_summary,n_GPCRs_keep,n_broadly_detectable,existing_drugs_for_picks,warning
LM,Lateral mammillary excitatory,143 MM-ant Foxb1 Glut,5437,"Foxb1, Lhx5, Pou4f1",Slc32a1,"Adcyap1r1, Avpr1a, Cckbr, Gabbr1, Gabbr2, Grm1, Hcrtr1, Hcrtr2, Mc4r, Oxtr, Sstr2","Htr2a(spec=1.70, log2=5.18, pct=73%, status=keep)","Htr2a[allen_only_keep, spec=+1.70, log2=5.18, pct=73%; drugs: Pimavanserin (Nuplazid; FDA Parkinson psychosis); Risperidone; Olanzapine; Aripiprazole; Trazodone; Mirtazapine; Quetiapine; Clozapine]; Gabbr1[paper+allen_broadly_detectable, spec=-1.09, log2=8.19, pct=97%; drugs: Baclofen (Lioresal); Arbaclofen Placarbil; Sodium oxybate (Xyrem)]; Gabbr2[paper+allen_broadly_detectable, spec=-1.74, log2=8.36, pct=97%; drugs: Baclofen (heterodimer with Gabbr1); Sodium oxybate]; Grm1[paper+allen_broadly_detectable, spec=-0.99, log2=8.85, pct=97%; drugs: research_only_or_none]; Adcyap1r1[paper_only_allen_downgrade, spec=-4.46, log2=2.93, pct=49%; drugs: research_only_or_none]; Avpr1a[paper_only_allen_downgrade, spec=-2.15, log2=0.00, pct=0%; drugs: research_only_or_none]; Cckbr[paper_only_allen_downgrade, spec=-2.99, log2=1.36, pct=24%; drugs: research_only_or_none]; Hcrtr1[paper_only_allen_downgrade, spec=-1.58, log2=0.05, pct=1%; drugs: research_only_or_none]; Hcrtr2[paper_only_allen_downgrade, spec=-4.97, log2=0.64, pct=11%; drugs: Suvorexant (Belsomra); Lemborexant (Dayvigo); Daridorexant (Quviviq) - all Dual Orexin Receptor Antagonists hitting both 1+2]; Mc4r[paper_only_allen_downgrade, spec=-1.20, log2=0.01, pct=0%; drugs: Setmelanotide (Imcivree; FDA 2020)]; Oxtr[paper_only_allen_downgrade, spec=-3.63, log2=0.00, pct=0%; drugs: research_only_or_none]; Sstr2[paper_only_allen_downgrade, spec=-1.93, log2=0.63, pct=12%; drugs: Octreotide; Lanreotide; Pasireotide (broad SSTR); Lutetium Lu-177 dotatate (radiotherapy)]","allen_only_keep: Htr2a | paper+broadly_detectable: Gabbr1, Gabbr2, Grm1 | paper_only: Adcyap1r1(downgrade,spec=-4.46,log2=2.93); Avpr1a(downgrade,spec=-2.15,log2=0.00); Cckbr(downgrade,spec=-2.99,log2=1.36); Hcrtr1(downgrade,spec=-1.58,log2=0.05); Hcrtr2(downgrade,spec=-4.97,log2=0.64); Mc4r(downgrade,spec=-1.20,log2=0.01); Oxtr(downgrade,spec=-3.63,log2=0.00); Sstr2(downgrade,spec=-1.93,log2=0.63)",1,3,Htr2a | FDA: Pimavanserin (Nuplazid; FDA Parkinson psychosis); Risperidone; Olanzapine; Aripiprazole; Trazodone; Mirtazapine; Quetiapine; Clozapine | clinical/research: Psilocybin (FDA breakthrough for depression); MDMA-assisted therapy; Ketanserin (Europe) | indication: Parkinson psychosis; schizophrenia; treatment-resistant depression (psychedelic trials) || Gabbr1 | FDA: Baclofen (Lioresal); Arbaclofen Placarbil; Sodium oxybate (Xyrem) | clinical/research: Lesogaberan | indication: spasticity (multiple sclerosis; spinal cord injury); narcolepsy (Xyrem); alcohol use disorder (off-label) || Gabbr2 | FDA: Baclofen (heterodimer with Gabbr1); Sodium oxybate | clinical/research: (see Gabbr1) | indication: (see Gabbr1) || Grm1 | clinical/research: research mGluR1 negative allosteric modulators (CFMTI) | indication: chronic pain; cerebellar ataxia (preclinical) || Adcyap1r1 | clinical/research: Maxadilan; Atrasentan-related (research) | indication: migraine research || Avpr1a | clinical/research: Balovaptan / RG7314 (autism trials FAILED 2020) | indication: autism social-cognition trials || Cckbr | clinical/research: Netazepide / YF476 (research antagonist) | indication: acid hypersecretion; anxiety (preclinical) || Hcrtr1 | clinical/research: SB-334867 (research selective antagonist) | indication: addiction; anxiety (preclinical) || Hcrtr2 | FDA: Suvorexant (Belsomra); Lemborexant (Dayvigo); Daridorexant (Quviviq) - all Dual Orexin Receptor Antagonists hitting both 1+2 | clinical/research: JNJ-42847922 (selective OX2R) | indication: insomnia || Mc4r | FDA: Setmelanotide (Imcivree; FDA 2020) | clinical/research: Bremelanotide (Vyleesi PT-141 - MC4 partial agonist for HSDD) | indication: rare genetic obesity (POMC/LEPR/PCSK1 deficiency; Bardet-Biedl syndrome); female sexual dysfunction (Bremelanotide) || Oxtr | clinical/research: Intranasal oxytocin (autism/social trials; mostly failed); Carbetocin (Pabal - postpartum hemorrhage outside USA) | indication: autism research; social cognition; postpartum hemorrhage (Carbetocin EU) || Sstr2 | FDA: Octreotide; Lanreotide; Pasireotide (broad SSTR); Lutetium Lu-177 dotatate (radiotherapy) | indication: acromegaly; neuroendocrine tumors (NETs); Cushing disease,
ORBm,L2/3 IT excitatory,007 L2/3 IT CTX Glut,8869,"Cdh13, Cux1, Cux2, Rorb, Satb2, Slc17a7","Gad1, Slc32a1","Cckbr, Cnr1, Gabbr1, Gabbr2, Grm1, Grm5, Htr2a, Npy1r, Oprd1, Oprm1, Sstr2","Cckbr(spec=0.08, log2=4.87, pct=73%, status=keep)","Cckbr[paper+allen_keep, spec=+0.08, log2=4.87, pct=73%; drugs: research_only_or_none]; Gabbr1[paper+allen_broadly_detectable, spec=-0.34, log2=8.47, pct=99%; drugs: Baclofen (Lioresal); Arbaclofen Placarbil; Sodium oxybate (Xyrem)]; Gabbr2[paper+allen_broadly_detectable, spec=-0.59, log2=9.02, pct=100%; drugs: Baclofen (heterodimer with Gabbr1); Sodium oxybate]; Grm1[paper+allen_broadly_detectable, spec=-0.90, log2=7.68, pct=94%; drugs: research_only_or_none]; Grm5[paper+allen_broadly_detectable, spec=-0.82, log2=10.48, pct=100%; drugs: research_only_or_none]; Cnr1[paper_only_allen_downgrade, spec=-6.50, log2=5.66, pct=83%; drugs: Dronabinol (Marinol; THC); Nabilone; Cannabidiol (CBD; partial action)]; Htr2a[paper_only_allen_downgrade, spec=-4.91, log2=2.84, pct=45%; drugs: Pimavanserin (Nuplazid; FDA Parkinson psychosis); Risperidone; Olanzapine; Aripiprazole; Trazodone; Mirtazapine; Quetiapine; Clozapine]; Npy1r[paper_only_allen_downgrade, spec=-2.34, log2=4.06, pct=64%; drugs: research_only_or_none]; Oprd1[paper_only_allen_downgrade, spec=-3.19, log2=1.39, pct=25%; drugs: research_only_or_none]; Oprm1[paper_only_allen_downgrade, spec=-3.60, log2=2.01, pct=35%; drugs: Morphine; Oxycodone; Hydrocodone; Methadone; Buprenorphine; Fentanyl; Tramadol; Naloxone (antag); Naltrexone (antag); Loperamide]; Sstr2[paper_only_allen_downgrade, spec=-7.42, log2=0.37, pct=7%; drugs: Octreotide; Lanreotide; Pasireotide (broad SSTR); Lutetium Lu-177 dotatate (radiotherapy)]","both_keep: Cckbr | paper+broadly_detectable: Gabbr1, Gabbr2, Grm1, Grm5 | paper_only: Cnr1(downgrade,spec=-6.50,log2=5.66); Htr2a(downgrade,spec=-4.91,log2=2.84); Npy1r(downgrade,spec=-2.34,log2=4.06); Oprd1(downgrade,spec=-3.19,log2=1.39); Oprm1(downgrade,spec=-3.60,log2=2.01); Sstr2(downgrade,spec=-7.42,log2=0.37)",1,4,Cckbr | clinical/research: Netazepide / YF476 (research antagonist) | indication: acid hypersecretion; anxiety (preclinical) || Gabbr1 | FDA: Baclofen (Lioresal); Arbaclofen Placarbil; Sodium oxybate (Xyrem) | clinical/research: Lesogaberan | indication: spasticity (multiple sclerosis; spinal cord injury); narcolepsy (Xyrem); alcohol use disorder (off-label) || Gabbr2 | FDA: Baclofen (heterodimer with Gabbr1); Sodium oxybate | clinical/research: (see Gabbr1) | indication: (see Gabbr1) || Grm1 | clinical/research: research mGluR1 negative allosteric modulators (CFMTI) | indication: chronic pain; cerebellar ataxia (preclinical) || Grm5 | clinical/research: Mavoglurant; Basimglurant; ADX-48621 (mostly failed Fragile X trials); Fenobam | indication: Fragile X syndrome (failed); anxiety; addiction (research) || Cnr1 | FDA: Dronabinol (Marinol; THC); Nabilone; Cannabidiol (CBD; partial action) | clinical/research: Rimonabant (withdrawn obesity drug); JZP-150 | indication: appetite stimulation (cancer/AIDS); chemotherapy nausea; epilepsy (CBD) || Htr2a | FDA: Pimavanserin (Nuplazid; FDA Parkinson psychosis); Risperidone; Olanzapine; Aripiprazole; Trazodone; Mirtazapine; Quetiapine; Clozapine | clinical/research: Psilocybin (FDA breakthrough for depression); MDMA-assisted therapy; Ketanserin (Europe) | indication: Parkinson psychosis; schizophrenia; treatment-resistant depression (psychedelic trials) || Npy1r | clinical/research: BIBP-3226 (research antagonist) | indication: obesity; pain (preclinical) || Oprd1 | clinical/research: DPDPE; ADL-5859; SNC-80 (research) | indication: depression; chronic pain (preclinical) || Oprm1 | FDA: Morphine; Oxycodone; Hydrocodone; Methadone; Buprenorphine; Fentanyl; Tramadol; Naloxone (antag); Naltrexone (antag); Loperamide | clinical/research: PZM21 (biased agonist research) | indication: chronic pain; opioid use disorder; analgesia || Sstr2 | FDA: Octreotide; Lanreotide; Pasireotide (broad SSTR); Lutetium Lu-177 dotatate (radiotherapy) | indication: acromegaly; neuroendocrine tumors (NETs); Cushing disease,
AId,Upper-layer IT excitatory,007 L2/3 IT CTX Glut,7697,"Cux1, Cux2, Rorb, Slc17a7","Gad1, Slc32a1","Cckbr, Cnr1, Gabbr1, Gabbr2, Grm5, Htr2a, Npy1r, Oprd1, Oprm1, Sstr2","Gpr88(spec=0.33, log2=4.77, pct=74%, status=keep)","Gpr88[allen_only_keep, spec=+0.33, log2=4.77, pct=74%; drugs: research_only_or_none]; Cckbr[paper+allen_broadly_detectable, spec=-1.05, log2=4.52, pct=71%; drugs: research_only_or_none]; Gabbr1[paper+allen_broadly_detectable, spec=-0.76, log2=8.52, pct=100%; drugs: Baclofen (Lioresal); Arbaclofen Placarbil; Sodium oxybate (Xyrem)]; Gabbr2[paper+allen_broadly_detectable, spec=-0.45, log2=9.12, pct=100%; drugs: Baclofen (heterodimer with Gabbr1); Sodium oxybate]; Grm5[paper+allen_broadly_detectable, spec=-0.28, log2=10.52, pct=100%; drugs: research_only_or_none]; Grm1[allen_only_broadly_detectable, spec=-0.92, log2=7.76, pct=96%; drugs: research_only_or_none]; Cnr1[paper_only_allen_downgrade, spec=-6.83, log2=5.24, pct=81%; drugs: Dronabinol (Marinol; THC); Nabilone; Cannabidiol (CBD; partial action)]; Htr2a[paper_only_allen_downgrade, spec=-2.79, log2=4.48, pct=69%; drugs: Pimavanserin (Nuplazid; FDA Parkinson psychosis); Risperidone; Olanzapine; Aripiprazole; Trazodone; Mirtazapine; Quetiapine; Clozapine]; Npy1r[paper_only_allen_downgrade, spec=-2.04, log2=3.75, pct=62%; drugs: research_only_or_none]; Oprd1[paper_only_allen_downgrade, spec=-2.71, log2=1.63, pct=30%; drugs: research_only_or_none]; Oprm1[paper_only_allen_downgrade, spec=-4.68, log2=2.21, pct=39%; drugs: Morphine; Oxycodone; Hydrocodone; Methadone; Buprenorphine; Fentanyl; Tramadol; Naloxone (antag); Naltrexone (antag); Loperamide]; Sstr2[paper_only_allen_downgrade, spec=-6.30, log2=0.56, pct=11%; drugs: Octreotide; Lanreotide; Pasireotide (broad SSTR); Lutetium Lu-177 dotatate (radiotherapy)]","allen_only_keep: Gpr88 | paper+broadly_detectable: Cckbr, Gabbr1, Gabbr2, Grm5 | allen_only_broadly_detectable: Grm1 | paper_only: Cnr1(downgrade,spec=-6.83,log2=5.24); Htr2a(downgrade,spec=-2.79,log2=4.48); Npy1r(downgrade,spec=-2.04,log2=3.75); Oprd1(downgrade,spec=-2.71,log2=1.63); Oprm1(downgrade,spec=-4.68,log2=2.21); Sstr2(downgrade,spec=-6.30,log2=0.56)",1,5,Gpr88 | clinical/research: RTI-13951-33 (research agonist) | indication: obsessive-compulsive disorder; addiction (preclinical) || Cckbr | clinical/research: Netazepide / YF476 (research antagonist) | indication: acid hypersecretion; anxiety (preclinical) || Gabbr1 | FDA: Baclofen (Lioresal); Arbaclofen Placarbil; Sodium oxybate (Xyrem) | clinical/research: Lesogaberan | indication: spasticity (multiple sclerosis; spinal cord injury); narcolepsy (Xyrem); alcohol use disorder (off-label) || Gabbr2 | FDA: Baclofen (heterodimer with Gabbr1); Sodium oxybate | clinical/research: (see Gabbr1) | indication: (see Gabbr1) || Grm5 | clinical/research: Mavoglurant; Basimglurant; ADX-48621 (mostly failed Fragile X trials); Fenobam | indication: Fragile X syndrome (failed); anxiety; addiction (research) || Grm1 | clinical/research: research mGluR1 negative allosteric modulators (CFMTI) | indication: chronic pain; cerebellar ataxia (preclinical) || Cnr1 | FDA: Dronabinol (Marinol; THC); Nabilone; Cannabidiol (CBD; partial action) | clinical/research: Rimonabant (withdrawn obesity drug); JZP-150 | indication: appetite stimulation (cancer/AIDS); chemotherapy nausea; epilepsy (CBD) || Htr2a | FDA: Pimavanserin (Nuplazid; FDA Parkinson psychosis); Risperidone; Olanzapine; Aripiprazole; Trazodone; Mirtazapine; Quetiapine; Clozapine | clinical/research: Psilocybin (FDA breakthrough for depression); MDMA-assisted therapy; Ketanserin (Europe) | indication: Parkinson psychosis; schizophrenia; treatment-resistant depression (psychedelic trials) || Npy1r | clinical/research: BIBP-3226 (research antagonist) | indication: obesity; pain (preclinical) || Oprd1 | clinical/research: DPDPE; ADL-5859; SNC-80 (research) | indication: depression; chronic pain (preclinical) || Oprm1 | FDA: Morphine; Oxycodone; Hydrocodone; Methadone; Buprenorphine; Fentanyl; Tramadol; Naloxone (antag); Naltrexone (antag); Loperamide | clinical/research: PZM21 (biased agonist research) | indication: chronic pain; opioid use disorder; analgesia || Sstr2 | FDA: Octreotide; Lanreotide; Pasireotide (broad SSTR); Lutetium Lu-177 dotatate (radiotherapy) | indication: acromegaly; neuroendocrine tumors (NETs); Cushing disease,
AId,Upper-layer IT excitatory,006 L4/5 IT CTX Glut,12177,"Cux1, Cux2, Rorb, Slc17a7","Gad1, Slc32a1","Cckbr, Cnr1, Gabbr1, Gabbr2, Grm5, Htr2a, Npy1r, Oprd1, Oprm1, Sstr2","Crhr1(spec=0.13, log2=3.94, pct=64%, status=keep)","Crhr1[allen_only_keep, spec=+0.13, log2=3.94, pct=64%; drugs: research_only_or_none]; Gabbr1[paper+allen_broadly_detectable, spec=-0.58, log2=8.70, pct=100%; drugs: Baclofen (Lioresal); Arbaclofen Placarbil; Sodium oxybate (Xyrem)]; Gabbr2[paper+allen_broadly_detectable, spec=-0.61, log2=8.96, pct=99%; drugs: Baclofen (heterodimer with Gabbr1); Sodium oxybate]; Grm5[paper+allen_broadly_detectable, spec=-1.07, log2=9.73, pct=100%; drugs: research_only_or_none]; Htr2a[paper+allen_broadly_detectable, spec=-0.69, log2=6.59, pct=91%; drugs: Pimavanserin (Nuplazid; FDA Parkinson psychosis); Risperidone; Olanzapine; Aripiprazole; Trazodone; Mirtazapine; Quetiapine; Clozapine]; Htr1f[allen_only_broadly_detectable, spec=-1.26, log2=6.28, pct=86%; drugs: Lasmiditan (Reyvow; FDA 2019)]; Cckbr[paper_only_allen_downgrade, spec=-1.60, log2=3.96, pct=64%; drugs: research_only_or_none]; Cnr1[paper_only_allen_downgrade, spec=-5.56, log2=6.51, pct=89%; drugs: Dronabinol (Marinol; THC); Nabilone; Cannabidiol (CBD; partial action)]; Npy1r[paper_only_allen_downgrade, spec=-2.45, log2=3.34, pct=56%; drugs: research_only_or_none]; Oprd1[paper_only_allen_downgrade, spec=-3.12, log2=1.22, pct=22%; drugs: research_only_or_none]; Oprm1[paper_only_allen_downgrade, spec=-4.84, log2=2.05, pct=36%; drugs: Morphine; Oxycodone; Hydrocodone; Methadone; Buprenorphine; Fentanyl; Tramadol; Naloxone (antag); Naltrexone (antag); Loperamide]; Sstr2[paper_only_allen_downgrade, spec=-5.69, log2=1.16, pct=20%; drugs: Octreotide; Lanreotide; Pasireotide (broad SSTR); Lutetium Lu-177 dotatate (radiotherapy)]","allen_only_keep: Crhr1 | paper+broadly_detectable: Gabbr1, Gabbr2, Grm5, Htr2a | allen_only_broadly_detectable: Htr1f | paper_only: Cckbr(downgrade,spec=-1.60,log2=3.96); Cnr1(downgrade,spec=-5.56,log2=6.51); Npy1r(downgrade,spec=-2.45,log2=3.34); Oprd1(downgrade,spec=-3.12,log2=1.22); Oprm1(downgrade,spec=-4.84,log2=2.05); Sstr2(downgrade,spec=-5.69,log2=1.16)",1,5,Crhr1 | clinical/research: Verucerfont; Pexacerfont; Antalarmin; Emicerfont (depression/PTSD trials mostly failed) | indication: PTSD; major depression; alcohol use disorder (mostly failed) || Gabbr1 | FDA: Baclofen (Lioresal); Arbaclofen Placarbil; Sodium oxybate (Xyrem) | clinical/research: Lesogaberan | indication: spasticity (multiple sclerosis; spinal cord injury); narcolepsy (Xyrem); alcohol use disorder (off-label) || Gabbr2 | FDA: Baclofen (heterodimer with Gabbr1); Sodium oxybate | clinical/research: (see Gabbr1) | indication: (see Gabbr1) || Grm5 | clinical/research: Mavoglurant; Basimglurant; ADX-48621 (mostly failed Fragile X trials); Fenobam | indication: Fragile X syndrome (failed); anxiety; addiction (research) || Htr2a | FDA: Pimavanserin (Nuplazid; FDA Parkinson psychosis); Risperidone; Olanzapine; Aripiprazole; Trazodone; Mirtazapine; Quetiapine; Clozapine | clinical/research: Psilocybin (FDA breakthrough for depression); MDMA-assisted therapy; Ketanserin (Europe) | indication: Parkinson psychosis; schizophrenia; treatment-resistant depression (psychedelic trials) || Htr1f | FDA: Lasmiditan (Reyvow; FDA 2019) | indication: migraine (acute attack) || Cckbr | clinical/research: Netazepide / YF476 (research antagonist) | indication: acid hypersecretion; anxiety (preclinical) || Cnr1 | FDA: Dronabinol (Marinol; THC); Nabilone; Cannabidiol (CBD; partial action) | clinical/research: Rimonabant (withdrawn obesity drug); JZP-150 | indication: appetite stimulation (cancer/AIDS); chemotherapy nausea; epilepsy (CBD) || Npy1r | clinical/research: BIBP-3226 (research antagonist) | indication: obesity; pain (preclinical) || Oprd1 | clinical/research: DPDPE; ADL-5859; SNC-80 (research) | indication: depression; chronic pain (preclinical) || Oprm1 | FDA: Morphine; Oxycodone; Hydrocodone; Methadone; Buprenorphine; Fentanyl; Tramadol; Naloxone (antag); Naltrexone (antag); Loperamide | clinical/research: PZM21 (biased agonist research) | indication: chronic pain; opioid use disorder; analgesia || Sstr2 | FDA: Octreotide; Lanreotide; Pasireotide (broad SSTR); Lutetium Lu-177 dotatate (radiotherapy) | indication: acromegaly; neuroendocrine tumors (NETs); Cushing disease,
CA,CA1 pyramidal,016 CA1-ProS Glut,24868,"Fibcd1, Mpped1, Pou3f1, Slc17a7, Spink8, Wfs1","Calb1, Cnih3, Prox1, Rgs14","Adcyap1r1, Cnr1, Drd1, Drd2, Gabbr1, Gabbr2, Grm1, Grm5, Htr1a, Htr1b, Htr2c, Oprm1, Sstr2","Htr1a(spec=0.96, log2=3.33, pct=55%, status=keep); Mc4r(spec=0.08, log2=1.12, pct=21%, status=keep)","Htr1a[paper+allen_keep, spec=+0.96, log2=3.33, pct=55%; drugs: Buspirone; Vilazodone; Vortioxetine (partial); Tandospirone (Japan); Gepirone]; Mc4r[allen_only_keep, spec=+0.08, log2=1.12, pct=21%; drugs: Setmelanotide (Imcivree; FDA 2020)]; Gabbr1[paper+allen_broadly_detectable, spec=-0.45, log2=8.70, pct=99%; drugs: Baclofen (Lioresal); Arbaclofen Placarbil; Sodium oxybate (Xyrem)]; Gabbr2[paper+allen_broadly_detectable, spec=-1.96, log2=7.93, pct=96%; drugs: Baclofen (heterodimer with Gabbr1); Sodium oxybate]; Grm1[paper+allen_broadly_detectable, spec=-1.93, log2=6.56, pct=85%; drugs: research_only_or_none]; Grm5[paper+allen_broadly_detectable, spec=-0.36, log2=10.79, pct=100%; drugs: research_only_or_none]; Adcyap1r1[paper_only_allen_downgrade, spec=-4.69, log2=1.63, pct=29%; drugs: research_only_or_none]; Cnr1[paper_only_allen_downgrade, spec=-7.05, log2=5.38, pct=80%; drugs: Dronabinol (Marinol; THC); Nabilone; Cannabidiol (CBD; partial action)]; Drd1[paper_only_allen_downgrade, spec=-1.77, log2=0.02, pct=0%; drugs: Apomorphine (mixed); Pergolide (partial)]; Drd2[paper_only_allen_downgrade, spec=-1.50, log2=0.01, pct=0%; drugs: Risperidone; Olanzapine; Aripiprazole; Quetiapine; Clozapine; Haloperidol; Paliperidone; Lurasidone; Bromocriptine; Cabergoline; Pramipexole; Ropinirole; Levodopa+Carbidopa (indirect)]; Htr1b[paper_only_allen_downgrade, spec=-1.27, log2=2.14, pct=38%; drugs: Sumatriptan; Rizatriptan; Zolmitriptan; Eletriptan; Naratriptan; Frovatriptan; Almotriptan]; Htr2c[paper_only_allen_downgrade, spec=-10.14, log2=1.80, pct=29%; drugs: Lorcaserin (Belviq) WITHDRAWN 2020 (cancer risk)]; Oprm1[paper_only_allen_downgrade, spec=-6.78, log2=0.18, pct=3%; drugs: Morphine; Oxycodone; Hydrocodone; Methadone; Buprenorphine; Fentanyl; Tramadol; Naloxone (antag); Naltrexone (antag); Loperamide]; Sstr2[paper_only_allen_downgrade, spec=-3.27, log2=0.51, pct=10%; drugs: Octreotide; Lanreotide; Pasireotide (broad SSTR); Lutetium Lu-177 dotatate (radiotherapy)]","both_keep: Htr1a | allen_only_keep: Mc4r | paper+broadly_detectable: Gabbr1, Gabbr2, Grm1, Grm5 | paper_only: Adcyap1r1(downgrade,spec=-4.69,log2=1.63); Cnr1(downgrade,spec=-7.05,log2=5.38); Drd1(downgrade,spec=-1.77,log2=0.02); Drd2(downgrade,spec=-1.50,log2=0.01); Htr1b(downgrade,spec=-1.27,log2=2.14); Htr2c(downgrade,spec=-10.14,log2=1.80); Oprm1(downgrade,spec=-6.78,log2=0.18); Sstr2(downgrade,spec=-3.27,log2=0.51)",2,4,Htr1a | FDA: Buspirone; Vilazodone; Vortioxetine (partial); Tandospirone (Japan); Gepirone | clinical/research: NLX-101 (depression) | indication: generalized anxiety; major depression || Mc4r | FDA: Setmelanotide (Imcivree; FDA 2020) | clinical/research: Bremelanotide (Vyleesi PT-141 - MC4 partial agonist for HSDD) | indication: rare genetic obesity (POMC/LEPR/PCSK1 deficiency; Bardet-Biedl syndrome); female sexual dysfunction (Bremelanotide) || Gabbr1 | FDA: Baclofen (Lioresal); Arbaclofen Placarbil; Sodium oxybate (Xyrem) | clinical/research: Lesogaberan | indication: spasticity (multiple sclerosis; spinal cord injury); narcolepsy (Xyrem); alcohol use disorder (off-label) || Gabbr2 | FDA: Baclofen (heterodimer with Gabbr1); Sodium oxybate | clinical/research: (see Gabbr1) | indication: (see Gabbr1) || Grm1 | clinical/research: research mGluR1 negative allosteric modulators (CFMTI) | indication: chronic pain; cerebellar ataxia (preclinical) || Grm5 | clinical/research: Mavoglurant; Basimglurant; ADX-48621 (mostly failed Fragile X trials); Fenobam | indication: Fragile X syndrome (failed); anxiety; addiction (research) || Adcyap1r1 | clinical/research: Maxadilan; Atrasentan-related (research) | indication: migraine research || Cnr1 | FDA: Dronabinol (Marinol; THC); Nabilone; Cannabidiol (CBD; partial action) | clinical/research: Rimonabant (withdrawn obesity drug); JZP-150 | indication: appetite stimulation (cancer/AIDS); chemotherapy nausea; epilepsy (CBD) || Drd1 | FDA: Apomorphine (mixed); Pergolide (partial) | clinical/research: SKF-81297; SKF-38393 (research agonists); SCH-23390 (antagonist) | indication: Parkinson disease; addiction research || Drd2 | FDA: Risperidone; Olanzapine; Aripiprazole; Quetiapine; Clozapine; Haloperidol; Paliperidone; Lurasidone; Bromocriptine; Cabergoline; Pramipexole; Ropinirole; Levodopa+Carbidopa (indirect) | clinical/research: many | indication: schizophrenia; bipolar; Parkinson disease; hyperprolactinemia || Htr1b | FDA: Sumatriptan; Rizatriptan; Zolmitriptan; Eletriptan; Naratriptan; Frovatriptan; Almotriptan | indication: migraine (acute attack) || Htr2c | FDA: Lorcaserin (Belviq) WITHDRAWN 2020 (cancer risk) | clinical/research: CT-7080; agomelatine (mixed) | indication: (historic obesity); current research for addiction || Oprm1 | FDA: Morphine; Oxycodone; Hydrocodone; Methadone; Buprenorphine; Fentanyl; Tramadol; Naloxone (antag); Naltrexone (antag); Loperamide | clinical/research: PZM21 (biased agonist research) | indication: chronic pain; opioid use disorder; analgesia || Sstr2 | FDA: Octreotide; Lanreotide; Pasireotide (broad SSTR); Lutetium Lu-177 dotatate (radiotherapy) | indication: acromegaly; neuroendocrine tumors (NETs); Cushing disease,
